{
  "contract": "contracts/globex-messaging.md",
  "vendor": "Globex Messaging Inc.",
  "rule": "breach_notification",
  "status": "compliant",
  "clause_ref": "\u00a77",
  "quote": "Globex will notify the customer within 24 hours of detecting a confirmed security incident affecting the customer's data.",
  "policy_quote": "Vendor must notify us within 72 hours of detecting a breach affecting our data. Violation: notice window >72 hours, or no specific window stated.",
  "reason": "24 hours is within the 72-hour maximum.",
  "suggested_fix": null
}
